trt_runner_dummy.py.log
[TensorRT] VERBOSE: *************** Autotuning format combination: Float(1,1,1,3) -> Float(1,1,1,3) ***************
[TensorRT] VERBOSE: --------------- Timing Runner: (Unnamed Layer* 8) [Pooling] (Pooling)
[TensorRT] VERBOSE: Tactic: -1 time 0.004448
[TensorRT] VERBOSE: Fastest Tactic: -1 Time: 0.004448
[TensorRT] VERBOSE: --------------- Timing Runner: (Unnamed Layer* 8) [Pooling] (TiledPooling)
[TensorRT] VERBOSE: Tactic: 7209217 time 0.004224
[TensorRT] VERBOSE: Fastest Tactic: 7209217 Time: 0.004224
[TensorRT] VERBOSE: >>>>>>>>>>>>>>> Chose Runner Type: TiledPooling Tactic: 7209217
[TensorRT] VERBOSE: 
[TensorRT] VERBOSE: *************** Autotuning format combination: Float(1,1,1,3) -> Float(1,3) ***************
[TensorRT] VERBOSE: --------------- Timing Runner: (Unnamed Layer* 9) [Shuffle] (Shuffle)
[TensorRT] VERBOSE: Tactic: 0 is the only option, timing skipped
[TensorRT] VERBOSE: Fastest Tactic: 0 Time: 0
[TensorRT] VERBOSE: *************** Autotuning format combination:  -> Float(1,11) ***************
[TensorRT] VERBOSE: *************** Autotuning format combination:  -> Float(1,11,33) ***************
[TensorRT] VERBOSE: *************** Autotuning format combination: Float(1,3), Float(1,11,33) -> Float(1,11) ***************
[TensorRT] VERBOSE: --------------- Timing Runner: (Unnamed Layer* 12) [Matrix Multiply] (MatrixMultiply)
[TensorRT] VERBOSE: Tactic: 0 is the only option, timing skipped
[TensorRT] VERBOSE: Fastest Tactic: 0 Time: 0
[TensorRT] VERBOSE: *************** Autotuning format combination: Float(1,11), Float(1,11) -> Float(1,11) ***************
[TensorRT] VERBOSE: --------------- Timing Runner: (Unnamed Layer* 13) [ElementWise] (ElementWise)
[TensorRT] VERBOSE: Tactic: 1 is the only option, timing skipped
[TensorRT] VERBOSE: Fastest Tactic: 1 Time: 0
[TensorRT] VERBOSE: *************** Autotuning format combination: Float(1,11) -> Float(1,11) ***************
[TensorRT] VERBOSE: --------------- Timing Runner: (Unnamed Layer* 14) [Softmax] + (Unnamed Layer* 15) [Unary] (SoftMax)
[TensorRT] VERBOSE: Tactic: 1001 time 0.004832
[TensorRT] VERBOSE: Fastest Tactic: 1001 Time: 0.004832
[TensorRT] VERBOSE: >>>>>>>>>>>>>>> Chose Runner Type: SoftMax Tactic: 1001
[TensorRT] VERBOSE: 
[TensorRT] VERBOSE: *************** Autotuning format combination: Float(1,1,1,3) -> Float(1,1,1,3) ***************
[TensorRT] VERBOSE: --------------- Timing Runner: (Unnamed Layer* 16) [Pooling] (Pooling)
[TensorRT] VERBOSE: Tactic: -1 time 0.004576
[TensorRT] VERBOSE: Fastest Tactic: -1 Time: 0.004576
[TensorRT] VERBOSE: --------------- Timing Runner: (Unnamed Layer* 16) [Pooling] (TiledPooling)
[TensorRT] VERBOSE: Tactic: 7209217 time 0.004704
[TensorRT] VERBOSE: Fastest Tactic: 7209217 Time: 0.004704
[TensorRT] VERBOSE: >>>>>>>>>>>>>>> Chose Runner Type: Pooling Tactic: -1
[TensorRT] VERBOSE: 
[TensorRT] VERBOSE: *************** Autotuning format combination: Float(1,1,1,3) -> Float(1,3) ***************
[TensorRT] VERBOSE: --------------- Timing Runner: (Unnamed Layer* 17) [Shuffle] (Shuffle)
[TensorRT] VERBOSE: Tactic: 0 is the only option, timing skipped
[TensorRT] VERBOSE: Fastest Tactic: 0 Time: 0
[TensorRT] VERBOSE: *************** Autotuning format combination:  -> Float(1,11) ***************
[TensorRT] VERBOSE: *************** Autotuning format combination:  -> Float(1,11,33) ***************
[TensorRT] VERBOSE: *************** Autotuning format combination: Float(1,3), Float(1,11,33) -> Float(1,11) ***************
[TensorRT] VERBOSE: --------------- Timing Runner: (Unnamed Layer* 20) [Matrix Multiply] (MatrixMultiply)
[TensorRT] VERBOSE: Tactic: 0 is the only option, timing skipped
[TensorRT] VERBOSE: Fastest Tactic: 0 Time: 0
[TensorRT] VERBOSE: *************** Autotuning format combination: Float(1,11), Float(1,11) -> Float(1,11) ***************
[TensorRT] VERBOSE: --------------- Timing Runner: (Unnamed Layer* 21) [ElementWise] (ElementWise)
[TensorRT] VERBOSE: Tactic: 1 is the only option, timing skipped
[TensorRT] VERBOSE: Fastest Tactic: 1 Time: 0
[TensorRT] VERBOSE: *************** Autotuning format combination: Float(1,11) -> Float(1,11) ***************
[TensorRT] VERBOSE: --------------- Timing Runner: (Unnamed Layer* 22) [Softmax] + (Unnamed Layer* 23) [Unary] (SoftMax)
[TensorRT] VERBOSE: Tactic: 1001 time 0.006016
[TensorRT] VERBOSE: Fastest Tactic: 1001 Time: 0.006016
[TensorRT] VERBOSE: >>>>>>>>>>>>>>> Chose Runner Type: SoftMax Tactic: 1001
[TensorRT] VERBOSE: 
[TensorRT] VERBOSE: *************** Autotuning format combination: Float(1,1,1,3) -> Float(1,1,1,3) ***************
[TensorRT] VERBOSE: --------------- Timing Runner: (Unnamed Layer* 24) [Pooling] (Pooling)
[TensorRT] VERBOSE: Tactic: -1 time 0.004608
[TensorRT] VERBOSE: Fastest Tactic: -1 Time: 0.004608
[TensorRT] VERBOSE: --------------- Timing Runner: (Unnamed Layer* 24) [Pooling] (TiledPooling)
[TensorRT] VERBOSE: Tactic: 7209217 time 0.004864
[TensorRT] VERBOSE: Fastest Tactic: 7209217 Time: 0.004864
[TensorRT] VERBOSE: >>>>>>>>>>>>>>> Chose Runner Type: Pooling Tactic: -1
[TensorRT] VERBOSE: 
[TensorRT] VERBOSE: *************** Autotuning format combination: Float(1,1,1,3) -> Float(1,3) ***************
[TensorRT] VERBOSE: --------------- Timing Runner: (Unnamed Layer* 25) [Shuffle] (Shuffle)
[TensorRT] VERBOSE: Tactic: 0 is the only option, timing skipped
[TensorRT] VERBOSE: Fastest Tactic: 0 Time: 0
[TensorRT] VERBOSE: *************** Autotuning format combination:  -> Float(1,11) ***************
[TensorRT] VERBOSE: *************** Autotuning format combination:  -> Float(1,11,33) ***************
[TensorRT] VERBOSE: *************** Autotuning format combination: Float(1,3), Float(1,11,33) -> Float(1,11) ***************
[TensorRT] VERBOSE: --------------- Timing Runner: (Unnamed Layer* 28) [Matrix Multiply] (MatrixMultiply)
[TensorRT] VERBOSE: Tactic: 0 is the only option, timing skipped
[TensorRT] VERBOSE: Fastest Tactic: 0 Time: 0
[TensorRT] VERBOSE: *************** Autotuning format combination: Float(1,11), Float(1,11) -> Float(1,11) ***************
[TensorRT] VERBOSE: --------------- Timing Runner: (Unnamed Layer* 29) [ElementWise] (ElementWise)
[TensorRT] VERBOSE: Tactic: 1 is the only option, timing skipped
[TensorRT] VERBOSE: Fastest Tactic: 1 Time: 0
[TensorRT] VERBOSE: *************** Autotuning format combination: Float(1,11) -> Float(1,11) ***************
[TensorRT] VERBOSE: --------------- Timing Runner: (Unnamed Layer* 30) [Softmax] + (Unnamed Layer* 31) [Unary] (SoftMax)
[TensorRT] VERBOSE: Tactic: 1001 time 0.004768
[TensorRT] VERBOSE: Fastest Tactic: 1001 Time: 0.004768
[TensorRT] VERBOSE: >>>>>>>>>>>>>>> Chose Runner Type: SoftMax Tactic: 1001
[TensorRT] VERBOSE: 
[TensorRT] VERBOSE: *************** Autotuning format combination: Float(1,1,1,3) -> Float(1,1,1,3) ***************
[TensorRT] VERBOSE: --------------- Timing Runner: (Unnamed Layer* 32) [Pooling] (Pooling)
[TensorRT] VERBOSE: Tactic: -1 time 0.004512
[TensorRT] VERBOSE: Fastest Tactic: -1 Time: 0.004512
[TensorRT] VERBOSE: --------------- Timing Runner: (Unnamed Layer* 32) [Pooling] (TiledPooling)
[TensorRT] VERBOSE: Tactic: 7209217 time 0.00464
[TensorRT] VERBOSE: Fastest Tactic: 7209217 Time: 0.00464
[TensorRT] VERBOSE: >>>>>>>>>>>>>>> Chose Runner Type: Pooling Tactic: -1
[TensorRT] VERBOSE: 
[TensorRT] VERBOSE: *************** Autotuning format combination: Float(1,1,1,3) -> Float(1,3) ***************
[TensorRT] VERBOSE: --------------- Timing Runner: (Unnamed Layer* 33) [Shuffle] (Shuffle)
[TensorRT] VERBOSE: Tactic: 0 is the only option, timing skipped
[TensorRT] VERBOSE: Fastest Tactic: 0 Time: 0
[TensorRT] VERBOSE: *************** Autotuning format combination:  -> Float(1,11) ***************
[TensorRT] VERBOSE: *************** Autotuning format combination:  -> Float(1,11,33) ***************
[TensorRT] VERBOSE: *************** Autotuning format combination: Float(1,3), Float(1,11,33) -> Float(1,11) ***************
[TensorRT] VERBOSE: --------------- Timing Runner: (Unnamed Layer* 36) [Matrix Multiply] (MatrixMultiply)
[TensorRT] VERBOSE: Tactic: 0 is the only option, timing skipped
[TensorRT] VERBOSE: Fastest Tactic: 0 Time: 0
[TensorRT] VERBOSE: *************** Autotuning format combination: Float(1,11), Float(1,11) -> Float(1,11) ***************
[TensorRT] VERBOSE: --------------- Timing Runner: (Unnamed Layer* 37) [ElementWise] (ElementWise)
[TensorRT] VERBOSE: Tactic: 1 is the only option, timing skipped
[TensorRT] VERBOSE: Fastest Tactic: 1 Time: 0
[TensorRT] VERBOSE: *************** Autotuning format combination: Float(1,11) -> Float(1,11) ***************
[TensorRT] VERBOSE: --------------- Timing Runner: (Unnamed Layer* 38) [Softmax] + (Unnamed Layer* 39) [Unary] (SoftMax)
[TensorRT] VERBOSE: Tactic: 1001 time 0.005952
[TensorRT] VERBOSE: Fastest Tactic: 1001 Time: 0.005952
[TensorRT] VERBOSE: >>>>>>>>>>>>>>> Chose Runner Type: SoftMax Tactic: 1001
[TensorRT] VERBOSE: 
[TensorRT] VERBOSE: Formats and tactics selection completed in 3.60861 seconds.
[TensorRT] VERBOSE: After reformat layers: 36 layers
[TensorRT] VERBOSE: Block size 1073741824
[TensorRT] VERBOSE: Block size 2048
[TensorRT] VERBOSE: Block size 512
[TensorRT] VERBOSE: Block size 512
[TensorRT] VERBOSE: Block size 512
[TensorRT] VERBOSE: Block size 512
[TensorRT] VERBOSE: Block size 0
[TensorRT] VERBOSE: Total Activation Memory: 1073745920
[TensorRT] INFO: Detected 5 inputs and 4 output network tensors.
[TensorRT] VERBOSE: Engine generation completed in 5.98656 seconds.
[TensorRT] VERBOSE: Engine Layer Information:
[TensorRT] VERBOSE: Layer: (Unnamed Layer* 0) [Slice] (Reformat), Tactic: 0, 16[Float(3,1,146)] -> 5[Float(3,1,146)]
[TensorRT] VERBOSE: Layer: (Unnamed Layer* 1) [Slice] (Reformat), Tactic: 0, 5[Float(3,1,1)] -> 6[Float(3,1,1)]
[TensorRT] VERBOSE: Layer: (Unnamed Layer* 2) [Slice] (Reformat), Tactic: 0, 16[Float(3,1,146)] -> 9[Float(3,1,146)]
[TensorRT] VERBOSE: Layer: (Unnamed Layer* 3) [Slice] (Reformat), Tactic: 1002, 9[Float(3,1,1)] -> 10[Float(3,1,1)]
[TensorRT] VERBOSE: Layer: (Unnamed Layer* 4) [Slice] (Reformat), Tactic: 0, 16[Float(3,1,146)] -> 13[Float(3,1,146)]
[TensorRT] VERBOSE: Layer: (Unnamed Layer* 5) [Slice] (Reformat), Tactic: 0, 13[Float(3,1,1)] -> 14[Float(3,1,1)]
[TensorRT] VERBOSE: Layer: (Unnamed Layer* 6) [Slice] (Reformat), Tactic: 0, 16[Float(3,1,146)] -> 17[Float(3,1,146)]
[TensorRT] VERBOSE: Layer: (Unnamed Layer* 7) [Slice] (Reformat), Tactic: 0, 17[Float(3,1,1)] -> 18[Float(3,1,1)]
[TensorRT] VERBOSE: Layer: (Unnamed Layer* 8) [Pooling] (PoolingTiled), Tactic: 7209217, 6[Float(3,1,1)] -> 19[Float(3,1,1)]
[TensorRT] VERBOSE: Layer: (Unnamed Layer* 10) [Constant] (Constant), Tactic: 0,  -> (Unnamed Layer* 10) [Constant]_output[Float(11)]
[TensorRT] VERBOSE: Layer: (Unnamed Layer* 11) [Constant] (Constant), Tactic: 0,  -> (Unnamed Layer* 11) [Constant]_output[Float(3,11)]
[TensorRT] VERBOSE: Layer: (Unnamed Layer* 12) [Matrix Multiply] (MatrixMultiply), Tactic: 0, 21[Float(3)], (Unnamed Layer* 11) [Constant]_output[Float(3,11)] -> (Unnamed Layer* 12) [Matrix Multiply]_output[Float(11)]
[TensorRT] VERBOSE: Layer: (Unnamed Layer* 13) [ElementWise] (ElementWise), Tactic: 1, (Unnamed Layer* 12) [Matrix Multiply]_output[Float(11)], (Unnamed Layer* 10) [Constant]_output[Float(11)] -> 22[Float(11)]
[TensorRT] VERBOSE: Layer: (Unnamed Layer* 14) [Softmax] + (Unnamed Layer* 15) [Unary] (SoftMax), Tactic: 1001, 22[Float(11)] -> 23[Float(11)]
[TensorRT] VERBOSE: Layer: (Unnamed Layer* 16) [Pooling] (Pooling), Tactic: -1, 10[Float(3,1,1)] -> 24[Float(3,1,1)]
[TensorRT] VERBOSE: Layer: (Unnamed Layer* 18) [Constant] (Constant), Tactic: 0,  -> (Unnamed Layer* 18) [Constant]_output[Float(11)]
[TensorRT] VERBOSE: Layer: (Unnamed Layer* 19) [Constant] (Constant), Tactic: 0,  -> (Unnamed Layer* 19) [Constant]_output[Float(3,11)]
[TensorRT] VERBOSE: Layer: (Unnamed Layer* 20) [Matrix Multiply] (MatrixMultiply), Tactic: 0, 26[Float(3)], (Unnamed Layer* 19) [Constant]_output[Float(3,11)] -> (Unnamed Layer* 20) [Matrix Multiply]_output[Float(11)]
[TensorRT] VERBOSE: Layer: (Unnamed Layer* 21) [ElementWise] (ElementWise), Tactic: 1, (Unnamed Layer* 20) [Matrix Multiply]_output[Float(11)], (Unnamed Layer* 18) [Constant]_output[Float(11)] -> 27[Float(11)]
[TensorRT] VERBOSE: Layer: (Unnamed Layer* 22) [Softmax] + (Unnamed Layer* 23) [Unary] (SoftMax), Tactic: 1001, 27[Float(11)] -> 28[Float(11)]
[TensorRT] VERBOSE: Layer: (Unnamed Layer* 24) [Pooling] (Pooling), Tactic: -1, 14[Float(3,1,1)] -> 29[Float(3,1,1)]
[TensorRT] VERBOSE: Layer: (Unnamed Layer* 26) [Constant] (Constant), Tactic: 0,  -> (Unnamed Layer* 26) [Constant]_output[Float(11)]
[TensorRT] VERBOSE: Layer: (Unnamed Layer* 27) [Constant] (Constant), Tactic: 0,  -> (Unnamed Layer* 27) [Constant]_output[Float(3,11)]
[TensorRT] VERBOSE: Layer: (Unnamed Layer* 28) [Matrix Multiply] (MatrixMultiply), Tactic: 0, 31[Float(3)], (Unnamed Layer* 27) [Constant]_output[Float(3,11)] -> (Unnamed Layer* 28) [Matrix Multiply]_output[Float(11)]
[TensorRT] VERBOSE: Layer: (Unnamed Layer* 29) [ElementWise] (ElementWise), Tactic: 1, (Unnamed Layer* 28) [Matrix Multiply]_output[Float(11)], (Unnamed Layer* 26) [Constant]_output[Float(11)] -> 32[Float(11)]
[TensorRT] VERBOSE: Layer: (Unnamed Layer* 30) [Softmax] + (Unnamed Layer* 31) [Unary] (SoftMax), Tactic: 1001, 32[Float(11)] -> 33[Float(11)]
[TensorRT] VERBOSE: Layer: (Unnamed Layer* 32) [Pooling] (Pooling), Tactic: -1, 18[Float(3,1,1)] -> 34[Float(3,1,1)]
[TensorRT] VERBOSE: Layer: (Unnamed Layer* 34) [Constant] (Constant), Tactic: 0,  -> (Unnamed Layer* 34) [Constant]_output[Float(11)]
[TensorRT] VERBOSE: Layer: (Unnamed Layer* 35) [Constant] (Constant), Tactic: 0,  -> (Unnamed Layer* 35) [Constant]_output[Float(3,11)]
[TensorRT] VERBOSE: Layer: (Unnamed Layer* 36) [Matrix Multiply] (MatrixMultiply), Tactic: 0, 36[Float(3)], (Unnamed Layer* 35) [Constant]_output[Float(3,11)] -> (Unnamed Layer* 36) [Matrix Multiply]_output[Float(11)]
[TensorRT] VERBOSE: Layer: (Unnamed Layer* 37) [ElementWise] (ElementWise), Tactic: 1, (Unnamed Layer* 36) [Matrix Multiply]_output[Float(11)], (Unnamed Layer* 34) [Constant]_output[Float(11)] -> 37[Float(11)]
[TensorRT] VERBOSE: Layer: (Unnamed Layer* 38) [Softmax] + (Unnamed Layer* 39) [Unary] (SoftMax), Tactic: 1001, 37[Float(11)] -> 38[Float(11)]
